{
  "policy_version": 1,
  "policy_id": "ruby-main-experiment-target-policy-v1",
  "decision_date": "2026-09-17",
  "decision_record": "docs/main-experiment-scope-20260917.md",
  "implemented_target_count": 34,
  "main_experiment_variant": "vulnerable-only",
  "secure_or_fixed_variants": "reproduction-only",
  "eligible_target_ids": [
    "ruby-web:object-authorization.customer-profile",
    "ruby-web:function-authorization.user-directory",
    "ruby-web:server-side-request-forgery.image-import",
    "ruby-web:path-traversal.report-download",
    "ruby-web:mass-assignment.profile-role",
    "ruby-web:sql-injection.product-search",
    "ruby-web:authentication-session.password-reset-swap",
    "ruby-web:authentication-session.unsigned-session-token",
    "ruby-web:security-misconfiguration.operations-status-secret",
    "ruby-web:security-misconfiguration.trusted-forwarding-header",
    "ruby-web:sensitive-data-exposure.support-error-diagnostic",
    "ruby-web:jenkins-derived.diagnostic-export-expansion",
    "ruby-web:business-workflow.refund-before-fulfillment",
    "ruby-web:race-condition.inventory-confirmation",
    "ruby-web:multi-stage.search-leak-session-takeover",
    "ruby-web:multi-stage.image-import-service-credential",
    "ruby-web:multi-stage.archive-upload-path-execution",
    "ruby-web:multi-stage.cross-shop-refund-chain",
    "ruby-web:multi-stage.remembered-session-role-chain",
    "ruby-web:geoserver-derived.seller-template-expression",
    "ruby-web:cryptographic-failure.signed-download-forgery",
    "ruby-web:resource-consumption.report-export-fanout",
    "ruby-web:business-workflow.bulk-promotion-redemption",
    "ruby-web:api-inventory.deprecated-operations-endpoint",
    "ruby-web:security-logging.audit-trail-erasure",
    "ruby-web:software-data-integrity.unsigned-partner-webhook",
    "cve-original:CVE-2024-23897",
    "cve-original:CVE-2024-36401",
    "cve-original:CVE-2025-3248"
  ],
  "excluded_targets": [
    {
      "target_id": "ruby-web:unsafe-file-upload.seller-document-preview",
      "attack_class": "stored-browser-script-execution",
      "reason_code": "xss-csrf-main-experiment-exclusion",
      "reason": "브라우저 스크립트 실행과 성공 판정은 재현했지만 2026-09-17 결정에 따라 공격자, 식별, 방어 효과 본 실험에서 제외합니다.",
      "main_experiment_status": "excluded",
      "preserve_for": ["vulnerability-reproduction", "success-judgment-validation"],
      "success_judgment": "verified",
      "request_identification": "not-adopted",
      "blocking": "not-evaluated-in-main-experiment"
    },
    {
      "target_id": "ruby-web:roundcube-derived.support-ticket-html-postprocess",
      "attack_class": "stored-xss",
      "reason_code": "xss-csrf-main-experiment-exclusion",
      "reason": "저장형 XSS 실행과 성공 판정은 재현했지만 2026-09-17 결정에 따라 공격자, 식별, 방어 효과 본 실험에서 제외합니다.",
      "main_experiment_status": "excluded",
      "preserve_for": ["vulnerability-reproduction", "success-judgment-validation"],
      "success_judgment": "verified",
      "request_identification": "not-adopted",
      "blocking": "not-evaluated-in-main-experiment"
    },
    {
      "target_id": "ruby-web:cross-site-request-forgery.support-role-change",
      "attack_class": "csrf",
      "reason_code": "xss-csrf-main-experiment-exclusion",
      "reason": "유도된 역할 변경과 성공 판정은 재현했지만 2026-09-17 결정에 따라 공격자, 식별, 방어 효과 본 실험에서 제외합니다.",
      "main_experiment_status": "excluded",
      "preserve_for": ["vulnerability-reproduction", "success-judgment-validation"],
      "success_judgment": "verified",
      "request_identification": "not-adopted",
      "blocking": "not-evaluated-in-main-experiment"
    },
    {
      "target_id": "cve-original:CVE-2024-42009",
      "attack_class": "stored-xss",
      "reason_code": "xss-csrf-main-experiment-exclusion",
      "reason": "Roundcube 취약판과 수정판의 재현 근거는 보존하지만 2026-09-17 결정에 따라 이 XSS 대상을 본 실험에서 제외합니다.",
      "main_experiment_status": "excluded",
      "preserve_for": ["vulnerability-reproduction", "success-judgment-validation"],
      "success_judgment": "verified",
      "request_identification": "not-adopted",
      "blocking": "not-evaluated-in-main-experiment"
    },
    {
      "target_id": "cve-original:CVE-2026-54433",
      "attack_class": "stored-xss",
      "reason_code": "xss-csrf-main-experiment-exclusion",
      "reason": "Roundcube 취약판과 수정판의 재현 근거는 보존하지만 2026-09-17 결정에 따라 이 XSS 대상을 본 실험에서 제외합니다.",
      "main_experiment_status": "excluded",
      "preserve_for": ["vulnerability-reproduction", "success-judgment-validation"],
      "success_judgment": "verified",
      "request_identification": "not-adopted",
      "blocking": "not-evaluated-in-main-experiment"
    }
  ],
  "historical_configuration_policy": "preserve-without-main-experiment-authority"
}
